question_id,doc_id,category,question,answer,retrieved_context,retrieved_pages,nli_label,verdict,entailment,neutral,contradiction
dji_mavic_pro_Q133,dji_mavic_pro.pdf,Safety Information Lookup,"What is the safety instruction regarding aged, chipped, or broken propellers?","DO NOT use aged, chipped,\nor broken propellers.","propellers. Handle with care. Use only the DJI approved propellers. Do not mix propeller types. Stand clear of the motors and DO NOT touch the propellers when they are spinning. Check that the propellers and motors are installed correctly and firmly before every flight. Ensure that all propellers are in good condition before each flight. DO NOT use aged, chipped, or broken propellers. To avoid injury, STAND CLEAR of and DO NOT touch propellers or motors when they are spinning. ONLY use original DJI propellers for a better and safer flight experience. Propellers White Ring Unmarked Figure Attach On Motors with white marks Motors without white marks Legends Lock : Turn the propellers in the indicated direction to mount and tighten.","27, 63, 56",neutral,UNCERTAIN,0.3557,0.6443,0.0
dyson_v12_Q001,dyson_v12.pdf,Specification Lookup,What is the display reading when the battery is fully charged?,100%,"User manual SV12 JN.00000 PN.000000-00-00 00.00.00 VERSION NO.01 Contents In the box Getting started The LCD screen Charging your machine Changing your click-in battery Caring for your floors Emptying your bin Cleaning your bin Washing your filter Clearing blockages Washing your Laser Slim Fluffy™ brush bar Clearing blockages from your Hair screw tool Cleaning your tools Looking after your machine Top view of the Dyson V12 detect slim machine, showing cleaner head, wand, bin and main body. Dyson V12 detect slim","5, 4, 1, 3, 6",neutral,UNCERTAIN,0.0081,0.9815,0.0104
dyson_v12_Q003,dyson_v12.pdf,Specification Lookup,What is the lowest ambient temperature at which the machine will operate or charge?,5°C(41°F),"User manual SV12 JN.00000 PN.000000-00-00 00.00.00 VERSION NO.01 Contents In the box Getting started The LCD screen Charging your machine Changing your click-in battery Caring for your floors Emptying your bin Cleaning your bin Washing your filter Clearing blockages Washing your Laser Slim Fluffy™ brush bar Clearing blockages from your Hair screw tool Cleaning your tools Looking after your machine Top view of the Dyson V12 detect slim machine, showing cleaner head, wand, bin and main body. Dyson V12 detect slim","13, 6, 3, 1, 4, 5",entailment,GROUNDED,0.833,0.1617,0.0053
dyson_v12_Q006,dyson_v12.pdf,Tool/Material Identification,What should I use to clean the dust bin?,a damp cloth,"back into the machine. Your machine could be damaged if used with a damp filter. Holding the filter by the hard, plastic end, tap the other end over the bin. Filter held in upright position, with the wider end in the palm of a hand. Water running from a tap into the narrower end. Filter with hand over the open end with arrows showing a shaking motion. The filter is located at the rear of your machine. A hand holding the filter with the narrow end pointing downwards with droplets of water being shaken from the filter and again, with the end pointing downwards shaking water out.","9, 10, 7, 13",neutral,UNCERTAIN,0.0566,0.896,0.0473
dyson_v12_Q007,dyson_v12.pdf,Tool/Material Identification,What kind of cloth is specified for cleaning the laser lens on the Laser Slim Fluffy™ cleaner head?,"a soft, dry, lint-free cloth","your brush bar into the cleaner head. Push the end cap back down to the closed position. Cleaning your laser lens To maintain optimum performance, keep your laser lens clean. Only clean the lens when the cleaner head is not attached to your machine. Use a soft, dry, lint-free cloth to wipe the lens. The end cap is located at the side of the cleaner head. Push this upwards to unlock the brush bar. Don't wash the end cap. The end cap should be attached to the cleaner head at an angle less than 90°, any angle greater than this will not allow the end cap to close.","1, 2, 9, 7, 10, 3",entailment,GROUNDED,0.8563,0.1396,0.0041
dyson_v12_Q011,dyson_v12.pdf,Procedural Step Inquiry,How do I empty the bin once the wand is removed?,"Hold the machine over the bin, pointing downwards.\n\nFirmly push the red bin release button. The bin will slide down, cleaning the shroud\nas it goes, and the bin base will open.","down, cleaning the shroud as it goes, and the bin base will open. The bin base won’t open if the red bin release button isn’t pushed down all the way. Release the dirt Cover your bin tightly in a dust proof bag while you empty. Remove the bin carefully, seal the bag tightly and dispose. Close your bin Push the bin base upwards until the bin and bin base click into place. Remove your wand If it is necessary to clean your bin, empty it as shown in the ‘Emptying your bin’ section. Press the red button located on the bin runner to release the bin and slide your bin off the runner.","7, 8",entailment,GROUNDED,0.5979,0.0234,0.3787
dyson_v12_Q013,dyson_v12.pdf,Procedural Step Inquiry,What is the correct procedure for re-installing the Laser Slim Fluffy™ brush bar after cleaning and drying?,Reattach the end cap to your brush bar.\n\nSlide your brush bar into the cleaner head. Push the end cap back down to\nthe closed position.,"your brush bar into the cleaner head. Push the end cap back down to the closed position. Cleaning your laser lens To maintain optimum performance, keep your laser lens clean. Only clean the lens when the cleaner head is not attached to your machine. Use a soft, dry, lint-free cloth to wipe the lens. The end cap is located at the side of the cleaner head. Push this upwards to unlock the brush bar. Don't wash the end cap. The end cap should be attached to the cleaner head at an angle less than 90°, any angle greater than this will not allow the end cap to close.","10, 12",entailment,GROUNDED,0.6932,0.009,0.2978
dyson_v12_Q017,dyson_v12.pdf,Location/Definition,What does the 'Filter' alert on the screen mean?,"Filter – the filter isn’t fitted correctly, or needs cleaning.","Battery health Run time countdown Alerts To get the best performance and life from your battery, use Eco or Auto/Med mode. When the battery needs charging, your machine will pulse three times and a low run time icon will appear on the screen. When your battery is empty, a red warning icon will appear on the screen. The alerts you might see are: Filter – the filter isn’t fitted correctly, or needs cleaning. Blockage – your machine has a blockage that needs removing. 4:50 Exit settings menu To exit the settings menu. Tap to scroll through the selection menu. Select ‘Exit menu’.","9, 8, 5, 4",neutral,UNCERTAIN,0.0277,0.9716,0.0008
dyson_v12_Q018,dyson_v12.pdf,Location/Definition,What problem does the 'Blockage' alert indicate?,Blockage – your machine has a blockage that needs removing.,"To check for blockages in the main body of the machine, remove the bin following the instructions in the Cleaning your bin section and remove the blockage. If you cannot clear an obstruction, you may need to remove the brush bars. Disconnect your machine from the charger before looking for blockages. Be careful not to touch the trigger and be aware of sharp objects. Leave your machine to cool down before looking for blockages. Don't use your machine when looking for blockages as this could cause injury. Clearing blockages Remove the bin and check for blockages in the main body of your machine.","8, 5, 4",neutral,UNCERTAIN,0.446,0.554,0.0
dyson_v12_Q024,dyson_v12.pdf,Conditional Logic/Causal Reasoning,Under what specific condition will the bin base fail to open during the emptying process?,The bin base won’t open if the red bin release button isn’t pushed down all the way.,"down, cleaning the shroud as it goes, and the bin base will open. The bin base won’t open if the red bin release button isn’t pushed down all the way. Release the dirt Cover your bin tightly in a dust proof bag while you empty. Remove the bin carefully, seal the bag tightly and dispose. Close your bin Push the bin base upwards until the bin and bin base click into place. Remove your wand If it is necessary to clean your bin, empty it as shown in the ‘Emptying your bin’ section. Press the red button located on the bin runner to release the bin and slide your bin off the runner.",7,entailment,GROUNDED,0.996,0.0037,0.0004
dyson_v12_Q025,dyson_v12.pdf,Conditional Logic/Causal Reasoning,Which power modes are recommended for maximizing battery life and performance?,Eco or Auto/Med mode.,"Battery health Run time countdown Alerts To get the best performance and life from your battery, use Eco or Auto/Med mode. When the battery needs charging, your machine will pulse three times and a low run time icon will appear on the screen. When your battery is empty, a red warning icon will appear on the screen. The alerts you might see are: Filter – the filter isn’t fitted correctly, or needs cleaning. Blockage – your machine has a blockage that needs removing. 4:50 Exit settings menu To exit the settings menu. Tap to scroll through the selection menu. Select ‘Exit menu’.","3, 5, 13",entailment,GROUNDED,0.9916,0.0072,0.0011
dyson_v12_Q026,dyson_v12.pdf,Safety Information Lookup,What crucial safety instruction relates to the trigger and potential sharp objects when inspecting for blockages?,Be careful not to touch the trigger and be aware of sharp objects.,"To check for blockages in the main body of the machine, remove the bin following the instructions in the Cleaning your bin section and remove the blockage. If you cannot clear an obstruction, you may need to remove the brush bars. Disconnect your machine from the charger before looking for blockages. Be careful not to touch the trigger and be aware of sharp objects. Leave your machine to cool down before looking for blockages. Don't use your machine when looking for blockages as this could cause injury. Clearing blockages Remove the bin and check for blockages in the main body of your machine.","12, 8, 7, 4",entailment,GROUNDED,0.9951,0.0048,0.0
dyson_v12_Q028,dyson_v12.pdf,Safety Information Lookup,What undesirable outcome might occur if a rotating brush bar is used on incompatible carpet types?,Some carpets will fuzz if a rotating brush bar is used when vacuuming.,"batteries to maintain even performance. Caring for your floors Check that the underside of the cleaner head or tool is clean and free from any objects that may cause damage. Before vacuuming your flooring, rugs, and carpets, check the manufacturer’s recommended cleaning instructions. The brush bar on your machine can damage certain carpet types and floors. Some carpets will fuzz if a rotating brush bar is used when vacuuming. If this happens, we recommend vacuuming without the motorised floor tool and consulting with your flooring manufacturer. Changing your click-in battery It’s important to fully charge your new machine before using it for the first time, and after every clean.","6, 2, 8, 12, 10",entailment,GROUNDED,0.9949,0.005,0.0
dyson_v12_Q029,dyson_v12.pdf,Safety Information Lookup,Which cleaning agents should be avoided for cleaning the bin to prevent damage to the machine?,"detergents, polishes or air fresheners","User manual SV12 JN.00000 PN.000000-00-00 00.00.00 VERSION NO.01 Contents In the box Getting started The LCD screen Charging your machine Changing your click-in battery Caring for your floors Emptying your bin Cleaning your bin Washing your filter Clearing blockages Washing your Laser Slim Fluffy™ brush bar Clearing blockages from your Hair screw tool Cleaning your tools Looking after your machine Top view of the Dyson V12 detect slim machine, showing cleaner head, wand, bin and main body. Dyson V12 detect slim","11, 13, 1, 6, 7, 8",entailment,GROUNDED,0.7639,0.229,0.0071
dyson_v12_Q044,dyson_v12.pdf,Tool/Material Identification,What is the recommended cleaning agent for the Hair screw tool's exterior?,Wipe over with a damp lint-free cloth.,"Cleaning your tools Don’t put any part of your machine in a dishwasher or use detergents, polishes or air fresheners. Wipe with a damp, lint-free cloth, without touching the connector end. Make sure your tools are completely dry before using. Combination tool Crevice tool Stubborn dirt brush Soft dusting brush","7, 9, 10, 12, 2, 11",entailment,GROUNDED,0.9804,0.0164,0.0032
dyson_v12_Q046,dyson_v12.pdf,Procedural Step Inquiry,How can I change the language shown on the LCD screen?,"To change the language on your screen, press the button and hold until the language list appears. Release the button. Tap the button to scroll through the language list to your preferred language. Press and hold the button until the countdown ends.","The LCD screen Settings menu Change language Change alert settings Control the settings on your machine using the button. To enter the settings menu, press and hold the button until the menu screen appears. Tap to scroll through the options available. The LCD screen shows your particle count information and performance, including the cleaning mode selected, remaining run time, filter maintenance and blockage information. To change the language on your screen, press the button and hold until the language list appears. Release the button. Tap the button to scroll through the language list to your preferred language. Press and hold the button until the countdown ends.","4, 5",entailment,GROUNDED,0.9522,0.0462,0.0016
dyson_v12_Q055,dyson_v12.pdf,Location/Definition,Where are the serial numbers located on my vacuum cleaner?,"You can find your serial numbers on your machine, battery and charger.","dusty, wipe with a damp lint-free cloth. Check for blockages in the cleaner head, tools and main body of your machine. Wash your filter regularly and leave to dry completely. Don’t use detergents or polishes to clean your machine. For more information and support for your machine go online: www.dyson.com/support Your serial numbers You can find your serial numbers on your machine, battery and charger. Use your serial number to register.","1, 13, 8, 6, 4",contradiction,HALLUCINATION,0.0066,0.2372,0.7562
dyson_v12_Q063,dyson_v12.pdf,Safety Information Lookup,What is the primary safety action required before initiating an inspection for blockages?,Disconnect your machine from the charger before looking for blockages.,"To check for blockages in the main body of the machine, remove the bin following the instructions in the Cleaning your bin section and remove the blockage. If you cannot clear an obstruction, you may need to remove the brush bars. Disconnect your machine from the charger before looking for blockages. Be careful not to touch the trigger and be aware of sharp objects. Leave your machine to cool down before looking for blockages. Don't use your machine when looking for blockages as this could cause injury. Clearing blockages Remove the bin and check for blockages in the main body of your machine.","8, 5, 13, 4",entailment,GROUNDED,0.9958,0.0041,0.0
dyson_v12_Q064,dyson_v12.pdf,Safety Information Lookup,"When attempting to locate blockages, what specific operational and physical hazards must be avoided?",Be careful not to touch the trigger and be aware of sharp objects.,"To check for blockages in the main body of the machine, remove the bin following the instructions in the Cleaning your bin section and remove the blockage. If you cannot clear an obstruction, you may need to remove the brush bars. Disconnect your machine from the charger before looking for blockages. Be careful not to touch the trigger and be aware of sharp objects. Leave your machine to cool down before looking for blockages. Don't use your machine when looking for blockages as this could cause injury. Clearing blockages Remove the bin and check for blockages in the main body of your machine.","12, 8, 7, 4, 5",entailment,GROUNDED,0.9951,0.0048,0.0
dyson_v12_Q071,dyson_v12.pdf,Specification Lookup,At what battery percentage is the machine considered fully charged according to the display?,Your battery is fully charged when the display shows 100%.,"your battery Align your battery with the handle and slide it in. Push firmly until it clicks into place. The charger connected from the power supply using the wall dock. The charger connected from the power supply directly into the front of the battery. Arrows showing the location of the Battery release button and the battery coming off the handle when the button is pressed. The battery is then shown being replaced on the base of the handle, clicking into place.","6, 3, 5, 13",contradiction,HALLUCINATION,0.0006,0.1769,0.8225
dyson_v12_Q074,dyson_v12.pdf,Specification Lookup,Is the brush bar of the Hair screw tool washable?,Your Hair screw tool doesn‘t have a washable brush bar.,"Clearing blockages from your Hair screw tool Remove the cover and brush bar Pull your brush bar firmly to remove it from the main body. Check and remove any obstructions from all three parts of your Hair screw tool. Your Hair screw tool isn't washable. Wipe over with a damp lint-free cloth. Don’t put any part of your machine in a dishwasher or use detergents, polishes or air fresheners. Remove the Hair screw tool from the wand or machine. Push the base plate open. Press the red lever down to release the cleaner head cover. Pull the cleaner head cover off the main body of the tool.","12, 10",entailment,GROUNDED,0.9976,0.0023,0.0001
dyson_v12_Q078,dyson_v12.pdf,Tool/Material Identification,"If the Hair screw tool needs cleaning, what should be used to wipe it over?",Wipe over with a damp lint-free cloth.,"Cleaning your tools Don’t put any part of your machine in a dishwasher or use detergents, polishes or air fresheners. Wipe with a damp, lint-free cloth, without touching the connector end. Make sure your tools are completely dry before using. Combination tool Crevice tool Stubborn dirt brush Soft dusting brush","7, 9, 10, 12, 11, 2",entailment,GROUNDED,0.9804,0.0164,0.0032
dyson_v12_Q080,dyson_v12.pdf,Tool/Material Identification,What types of cleaning products are explicitly warned against using on the machine itself?,Don’t use detergents or polishes to clean your machine.,"Cleaning your tools Don’t put any part of your machine in a dishwasher or use detergents, polishes or air fresheners. Wipe with a damp, lint-free cloth, without touching the connector end. Make sure your tools are completely dry before using. Combination tool Crevice tool Stubborn dirt brush Soft dusting brush","13, 11, 8, 12, 6",entailment,GROUNDED,0.9968,0.0029,0.0003
dyson_v12_Q090,dyson_v12.pdf,Location/Definition,On what parts of the Dyson V12 detect slim can I find its serial numbers?,"You can find your serial numbers on your machine, battery and charger.","dusty, wipe with a damp lint-free cloth. Check for blockages in the cleaner head, tools and main body of your machine. Wash your filter regularly and leave to dry completely. Don’t use detergents or polishes to clean your machine. For more information and support for your machine go online: www.dyson.com/support Your serial numbers You can find your serial numbers on your machine, battery and charger. Use your serial number to register.","1, 13, 8, 6, 4",contradiction,HALLUCINATION,0.0066,0.2372,0.7562
dyson_v12_Q092,dyson_v12.pdf,Conditional Logic/Causal Reasoning,"For achieving the best battery life and performance, which cleaning modes are advised?","To get the best perform|ance and life from your battery, use Eco or Auto/Med mode.","Battery health Run time countdown Alerts To get the best performance and life from your battery, use Eco or Auto/Med mode. When the battery needs charging, your machine will pulse three times and a low run time icon will appear on the screen. When your battery is empty, a red warning icon will appear on the screen. The alerts you might see are: Filter – the filter isn’t fitted correctly, or needs cleaning. Blockage – your machine has a blockage that needs removing. 4:50 Exit settings menu To exit the settings menu. Tap to scroll through the selection menu. Select ‘Exit menu’.","3, 5, 13, 6",entailment,GROUNDED,0.9941,0.0058,0.0001
dyson_v12_Q130,dyson_v12.pdf,Specification Lookup,What is the recommended angle for reattaching the end cap to the Laser Slim Fluffy™ cleaner head?,less than 90°,"cap. The end cap should be attached to the cleaner head at an angle less than 90°, any angle greater than this will not allow the end cap to close. The brush bar an open end and a closed end. Stand upright, with the closed end facing upwards, to dry.","6, 13, 9, 10, 8, 3",entailment,GROUNDED,0.9345,0.061,0.0046
dyson_v12_Q132,dyson_v12.pdf,Conditional Logic/Causal Reasoning,What could be an adverse effect of overfilling the bin on the particle graph readings?,Overfilling your bin could result in inaccurate readings on the particle graph.,"empty it as shown in the ‘Emptying your bin’ section. Press the red button located on the bin runner to release the bin and slide your bin off the runner. Only clean your bin with a damp cloth. Make sure that the bin and seals are completely dry before replacing. Cleaning your bin Remove your bin Refit your bin Overfilling your bin could result in inaccurate readings on the particle graph. Insert the spine on to the bin runner. Close your bin by pushing the bin base upwards until the bin and bin base click into place. Your bin isn’t dishwasher safe and the use of detergents, polishes or air fresheners to clean your bin isn’t recommended, as it may damage your machine.","7, 8, 4",neutral,UNCERTAIN,0.1066,0.8927,0.0007
dyson_v12_Q134,dyson_v12.pdf,Procedural Step Inquiry,How should one refit the battery onto the machine?,Align your battery with the handle and slide it in. Push firmly until it clicks\ninto place.,"your battery Align your battery with the handle and slide it in. Push firmly until it clicks into place. The charger connected from the power supply using the wall dock. The charger connected from the power supply directly into the front of the battery. Arrows showing the location of the Battery release button and the battery coming off the handle when the button is pressed. The battery is then shown being replaced on the base of the handle, clicking into place.","6, 10, 12, 13, 8",entailment,GROUNDED,0.9872,0.0118,0.001
electrolux_oven_Q001,electrolux_oven.pdf,Specification Lookup,What voltage and frequency is the oven EOB63100 designed to be connected to?,230-240V~(50Hz),"electricity supply (mains), with a mini­ mum gap of 3 mm between the switch contacts and of a type suitable for the required load in compliance with the current regulations. The switch must not break the yellow and green earth cable at any point. Important After installation and connecting, the ca­ ble must be placed so that it cannot at any point reach a temperature of more than 50 °C above the ambient tempera­ ture. Before the oven is connected, check that the main fuse and the domestic in­ stallation can support the load; and that the power supply is properly earthed.","49, 1, 33, 14, 24, 30",neutral,UNCERTAIN,0.0068,0.9918,0.0013
electrolux_oven_Q006,electrolux_oven.pdf,Tool/Material Identification,What accessories are included with the oven in the grill set?,The grill set consists of grill and roasting pan.,"description of the appliance electrolux 9 Oven Accessories Shelf For dishes, cake tins, items for roasting and grilling. Grill set Grill Insert for the roasting pan for roasting and grilling. Roasting Pan For baking and roasting or as a pan for collecting fat.","17, 35, 9, 33, 8, 14, 10",entailment,GROUNDED,0.9938,0.0054,0.0009
electrolux_oven_Q011,electrolux_oven.pdf,Procedural Step Inquiry,How do I perform the initial cleaning of the oven before first use?,"1. Turn the oven function switch to oven lighting . 2. Remove all accessories and the shelf support rails and wash them with warm water and washing up liquid. 3. Wash the floor of the oven in the same way using warm soapy water, and allow to dry. 4. Wipe the front of the appliance with a damp cloth.","and bleaches • Impregnated pads unsuitable for non-stick saucepans • Brillo/Ajax pads or steel wool pads • Chemical oven pads or aerosols • Rust removers • Bath/Sink stain removers 1. Turn the oven function switch to oven lighting . 2. Remove all accessories and the shelf support rails and wash them with warm water and washing up liquid. 3. Wash the floor of the oven in the same way using warm soapy water, and allow to dry. 4. Wipe the front of the appliance with a damp cloth.","11, 39, 42, 40, 7",entailment,GROUNDED,0.9951,0.0045,0.0003
electrolux_oven_Q012,electrolux_oven.pdf,Procedural Step Inquiry,What are the steps to switch the oven on and then off?,"1. Turn the oven functions control knob to the desired function. 2. Turn the temperature control knob to the desired temperature. The power indicator is lit while the oven is on. The temperature power indicator is lit while the oven is heating up. 3. To turn the oven off, turn the oven func- tions and temperature control knob back to the Off position.","operating the oven electrolux 13 Switching the Oven On and Off 1. Turn the oven functions control knob to the desired function. 2. Turn the temperature control knob to the desired temperature. The power indicator is lit while the oven is on. The temperature power indicator is lit while the oven is heating up. 3. To turn the oven off, turn the oven functions and temperature control knob back to the Off position. Cooling fan The fan switches on automatically in order to keep the appliance’s sur­ faces cool. When the oven is switched off, the fan continues to run to cool the appliance down, then switches itself off automatically.","13, 19, 21, 22, 39, 8",entailment,GROUNDED,0.9943,0.0051,0.0006
