question_id,doc_id,category,question,answer,retrieved_context,retrieved_pages,nli_label,verdict,entailment,neutral,contradiction
apple_watch_Q001,apple_watch.pdf,Specification Lookup,Which watchOS version is this user guide based on?,watchOS 8.6,Apple Watch User Guide Everything you need to know about Apple Watch watchOS 8.6,"1, 8, 7, 9, 16, 280",entailment,GROUNDED,0.9384,0.0614,0.0002
apple_watch_Q003,apple_watch.pdf,Specification Lookup,What are the recommended ambient operating temperatures for Apple Watch?,between 32° and 95° F (0° and 35° C),"to USB-C Cable, Apple Watch Magnetic Charging Cable, and Apple Watch Magnetic Charging Dock The radiated output power of this device meets the limits of FCC/IC radio frequency exposure limits. This device should be operated with a minimum separation distance of 20 cm (8 inches) between the equipment and a person’s body. La puissance de sortie rayonnée de cet appareil est conforme aux limites de la FCC/IC limites d'exposition aux fréquences radio. Cet appareil doit être utilisé avec une distance minimale de séparation de 20 cm entre l’appareil et le corps d’une personne.","287, 289, 99, 247",entailment,GROUNDED,0.9981,0.0019,0.0
apple_watch_Q004,apple_watch.pdf,Specification Lookup,"For Apple Watch Series 7, what type of charging cable is included?",Apple Watch Magnetic Fast Charger to USB-C Cable,"(GPS + Cellular), Apple Watch SE (GPS + Cellular), Apple Watch Series 6 (GPS + Cellular), or Apple Watch Series 7 (GPS + Cellular) may make the device feel warm. Use common sense to avoid situations where your skin is in contact with Apple Watch, the Apple Watch Magnetic Fast Charger to USB-C Cable, the Apple Watch Magnetic Charging Cable, the MagSafe Duo Charger, the Apple Watch Magnetic Charging Dock, or the power adapter for long periods of time when they’re plugged in. For example, while Apple Watch is charging or while the Apple Watch Magnetic Fast Charger to USB-C Cable, the Apple Watch Magnetic Charging Cable, the MagSafe Duo Charger, the Apple Watch Magnetic Charging Dock, or the power adapter are plugged in to a power source, don’t sleep on them or place them under a blanket, pillow, or your body.","24, 282, 283, 12",neutral,UNCERTAIN,0.1612,0.8388,0.0001
apple_watch_Q005,apple_watch.pdf,Specification Lookup,What is the Bluetooth range required for the 'Unlock with iPhone' feature to work?,about 33 feet or 10 meters,"to USB-C Cable, Apple Watch Magnetic Charging Cable, and Apple Watch Magnetic Charging Dock The radiated output power of this device meets the limits of FCC/IC radio frequency exposure limits. This device should be operated with a minimum separation distance of 20 cm (8 inches) between the equipment and a person’s body. La puissance de sortie rayonnée de cet appareil est conforme aux limites de la FCC/IC limites d'exposition aux fréquences radio. Cet appareil doit être utilisé avec une distance minimale de séparation de 20 cm entre l’appareil et le corps d’une personne.","289, 156, 204, 30, 63, 207, 206",entailment,GROUNDED,0.9956,0.0044,0.0
apple_watch_Q006,apple_watch.pdf,Tool/Material Identification,Which app should I use to check my blood oxygen levels?,Blood Oxygen app,with Blood Oxygen app on Apple Watch. Calculator See Calculator. Calendar See Check and update your calendar on Apple Watch. Camera Remote See Use Camera and timer on Apple Watch. Compass (Apple Watch SE and Apple Watch Series 5 and later only) See Use Compass on Apple Watch. Contacts See Add and use contact information on Apple Watch. Cycle Tracking See Use Cycle Tracking on Apple Watch.,"151, 152, 50",entailment,GROUNDED,0.9896,0.0102,0.0002
apple_watch_Q007,apple_watch.pdf,Tool/Material Identification,What specific app allows users to locate misplaced Apple devices on their Apple Watch?,Find Devices,"redesigned to make it easier than ever to control the smart devices in your home by highlighting the accessories you’re most likely to use based on the time of day. See Control your home. Locate misplaced devices and items In addition to finding your friends, you can now locate your missing Apple devices and AirTags with the new Find Devices and Find Items apps on Apple Watch. See Find misplaced devices.","165, 14, 205, 166, 66",entailment,GROUNDED,0.9548,0.0431,0.0021
apple_watch_Q009,apple_watch.pdf,Tool/Material Identification,What specific app provides guided Meditations for Apple Fitness+ subscribers on Apple Watch?,Mindfulness app,"finger. See Compose a message. Enjoy a mindful moment The new Reflect feature in the Mindfulness app helps you establish a meditation practice by focusing on a short, thought-provoking theme. With an Apple Fitness+ subscription, listen to guided Meditations right on Apple Watch. See Start a Reflect or Breathe session and Listen to guided Meditations.","13, 192, 193, 194, 126, 195",neutral,UNCERTAIN,0.4919,0.5072,0.0009
apple_watch_Q011,apple_watch.pdf,Procedural Step Inquiry,How do I turn off my Apple Watch?,"press and hold the side button until the sliders appear, then drag the Power Off slider to the right.","of the time, but if you need to turn it off, press and hold the side button until the sliders appear, then drag the Power Off slider to the right. Tip: You can’t turn off your Apple Watch while it’s charging. To turn off your Apple Watch, first disconnect it from the charger.","28, 62, 274, 61, 71",entailment,GROUNDED,0.9434,0.0561,0.0005
apple_watch_Q013,apple_watch.pdf,Procedural Step Inquiry,How do I force my Apple Watch to restart if it's unresponsive?,"hold down the side button and the Digital Crown at the same time for at least ten seconds, until the Apple logo appears.","logo appears. Force Apple Watch to restart If you can’t turn off your Apple Watch or if the problem continues, you may need to force your Apple Watch to restart. Do this only if you’re unable to restart your Apple Watch. To force restart, hold down the side button and the Digital Crown at the same time for at least ten seconds, until the Apple logo appears.","274, 262, 18, 103, 29, 26, 58",entailment,GROUNDED,0.9821,0.0168,0.0011
apple_watch_Q014,apple_watch.pdf,Procedural Step Inquiry,How do I remove and change an Apple Watch band?,"1. Press the band release button on your Apple Watch.\n2. Slide the band across to remove it, then slide the new band in.","Bands designed for early Apple Watch models also work with Apple Watch Series 4, Apple Watch Series 5, Apple Watch SE, Apple Watch Series 6, and Apple Watch Series 7. Remove and change bands 1. Press the band release button on your Apple Watch. 2. Slide the band across to remove it, then slide the new band in. Never force a band into the slot. If you’re having trouble removing or inserting a band, press the band release button again. Fasten a band For optimal performance, your Apple Watch should fit closely on your wrist. For best results, the back of your Apple Watch needs skin contact for features like wrist detection, haptic notifications, and the heart rate sensor.","19, 34, 42, 197, 288, 220",neutral,UNCERTAIN,0.0763,0.9217,0.002
apple_watch_Q016,apple_watch.pdf,Location/Definition,Where can I find the setting to turn on Fall Detection for users aged 18-55?,"Open the Settings app on your Apple Watch.\nGo to SOS > Fall Detection, then turn on Fall Detection.","emergency services without a countdown. If you don’t want your Apple Watch to automatically start the emergency countdown when you press and hold the side button, turn off Automatic Dialing. Open the Settings app on your Apple Watch, tap SOS, tap Hold Side Button, then turn off Hold Side Button. (Or open the Apple Watch app on your iPhone, tap My Watch, tap Emergency SOS, then turn off Hold Side Button.) You can still make an emergency call with the Emergency SOS slider. If fall detection is enabled and you have been immobile for about a minute after Apple Watch detects a hard fall, it will attempt to make a call to emergency services automatically.","77, 209, 76",entailment,GROUNDED,0.5008,0.4934,0.0058
apple_watch_Q018,apple_watch.pdf,Location/Definition,What is the 'Burn Bar' displayed during certain Apple Fitness+ workouts?,shows how your metrics compare to others who have done the workout before,"Apple Watch User Guide Change what’s on the screen during an Apple Fitness+ workout Change onscreen metrics During your workout, you can track your progress onscreen for each of your rings, as well as your heart rate and calories burned, all shown in real time on your device. Some workouts also display the Burn Bar, which shows how your metrics compare to others who have done the workout before. The more calories you burn, the higher you land on the Burn Bar. Your position on the Burn Bar is saved in your workout summary along with your other metrics. You can change the metrics from Apple Watch that you see on the screen during a workout.","139, 128, 169, 143, 140",entailment,GROUNDED,0.998,0.002,0.0
apple_watch_Q020,apple_watch.pdf,Location/Definition,How is Control Center accessed from the watch face?,"From the watch face, swipe up.","face: Firmly press the display, swipe down to choose Customize, then double-tap. Swipe left or right to browse the customizable features. Turn the Digital Crown to customize the selected feature. When you finish, press the Digital Crown, then double-tap the face to save your changes. • Check notifications from the watch face: Swipe down with two fingers. To check notifications from most other screens, tap the time in the top-right of the display, then swipe down with two fingers. • Open Control Center from the watch face: Swipe up with two fingers. To open Control Center from most other screens, tap the time in the top-right of the display, then swipe up with two fingers.","262, 264, 18, 96, 93, 60, 62, 19",entailment,GROUNDED,0.9956,0.0037,0.0007
apple_watch_Q021,apple_watch.pdf,Conditional Logic/Causal Reasoning,What are some consequences of turning off wrist detection on my Apple Watch?,"When you use Apple Pay on your Apple Watch, you’ll be prompted to enter your passcode...\nSome Activity measurements are unavailable.\nHeart rate tracking and notifications are turned off.\nApple Watch will no longer automatically lock and unlock.",prompted to enter your passcode when you double-click the side button to authorize the payment. • Some Activity measurements are unavailable. • Heart rate tracking and notifications are turned off. • Apple Watch will no longer automatically lock and unlock. • Apple Watch SE and Apple Watch Series 4 and later wonʼt automatically make an emergency call even after it has detected a hard impact fall.,"31, 233, 278, 73, 82, 56, 281",entailment,GROUNDED,0.51,0.49,0.0001
apple_watch_Q023,apple_watch.pdf,Conditional Logic/Causal Reasoning,What might cause the Apple Watch Magnetic Charging Cable surface to become discolored after regular use?,dirt and debris that come in contact with the magnetic surface,"to a button or the Digital Crown on Apple Watch, or force a charging connector into a port, because this may cause damage that is not covered under the warranty. If the connector and port don’t join with reasonable ease, they probably don’t match. Check for obstructions and make sure that the connector matches the port and that you have positioned the connector correctly in relation to the port. Certain usage patterns can contribute to the fraying or breaking of cables. The cable attached to a charging unit, like any other metal wire or cable, is subject to becoming weak or brittle if repeatedly bent in the same spot.","286, 289, 283, 290, 24",neutral,UNCERTAIN,0.0042,0.9956,0.0002
apple_watch_Q024,apple_watch.pdf,Conditional Logic/Causal Reasoning,"If I don't respond to a notification when it arrives, where is it saved?",it’s saved in Notification Center,"To clear all notifications, scroll to the top of the screen, then tap Clear All. If you use group notifications, tap a group to open it, then tap a notification. Tip: To keep the red dot from appearing on the watch face, open the Settings app on your Apple Watch, tap Notifications, then turn off Notifications Indicator. Silence all notifications on Apple Watch Touch and hold the bottom of the screen, swipe up to open Control Center, then tap . You still feel a tap when a notification arrives. To prevent sound and taps, follow these steps: 1. Touch and hold the bottom of the screen, then swipe up to open Control Center.","70, 71, 4, 72, 168, 166, 73",neutral,UNCERTAIN,0.0778,0.89,0.0322
apple_watch_Q025,apple_watch.pdf,Conditional Logic/Causal Reasoning,What happens if my Apple Watch battery charge drops to 10 percent or lower?,your Apple Watch alerts you and gives you the opportunity to enter Power Reserve mode.,"remaining charge appears on this screen. When battery charge drops to 10 percent or lower, your Apple Watch alerts you and gives you the opportunity to enter Power Reserve mode. When your Apple Watch is almost out of power, it enters Power Reserve mode automatically. Tip: For tips on maximizing battery life, see Maximizing Battery Life and Lifespan at the Apple website. Return to normal power mode Restart your Apple Watch—press and hold the side button until the Apple logo appears. The battery must have at least 10 percent charge for your Apple Watch to restart. Check time since the last charge 1.","27, 256, 70, 28",entailment,GROUNDED,0.9869,0.0129,0.0002
apple_watch_Q026,apple_watch.pdf,Safety Information Lookup,What should I do if my Apple Watch becomes uncomfortably warm while charging or in use?,Remove Apple Watch if it becomes uncomfortably warm.,"Apple Watch Magnetic Charging Dock, or the power adapter are plugged in to a power source, don’t sleep on them or place them under a blanket, pillow, or your body. Take special care if you have a physical condition that affects your ability to detect heat against the body. Remove Apple Watch if it becomes uncomfortably warm.","282, 287, 286, 284, 28",neutral,UNCERTAIN,0.0028,0.9971,0.0
apple_watch_Q028,apple_watch.pdf,Safety Information Lookup,What potential hazard is mentioned regarding charging Apple Watch when moisture is present?,"can cause fire, electric shock, injury, or damage to Apple Watch or other property","Apple Watch User Guide Safety and handling Important safety information for Apple Watch WARNING: Failure to follow these safety instructions could result in fire, electric shock, injury, or damage to Apple Watch or other property. Read all the safety information below before using Apple Watch. Handling Handle Apple Watch with care. Apple Watch cases are made of various materials that include the following: • Aluminum Apple Watch case—7000 series aluminum, Ion-X glass (strengthened glass), composite back (plastic) • Stainless Steel Apple Watch case—Stainless steel, sapphire crystal, ceramic back • Titanium Apple Watch case—Titanium, sapphire crystal, ceramic back • Ceramic Apple Watch case—Ceramic, sapphire crystal, ceramic back Apple Watch contains sensitive electronic components and can be damaged if dropped, burned, punctured, or crushed.","284, 282, 281, 286, 283, 285",entailment,GROUNDED,0.962,0.0379,0.0001
apple_watch_Q029,apple_watch.pdf,Safety Information Lookup,What action should be taken regarding electronic device restrictions when using Apple Watch?,Observe signs and notices that prohibit or restrict the use of electronic devices.,"your cellular plan. Accessibility Configure accessibility settings. Emergency SOS Turn on or off the option to hold the side button to call emergency services, and add and change emergency contacts. Schooltime Set up a Schooltime schedule. See Get started with Schooltime. Screen Time Manage parental controls, get insights about your family member’s screen time, and set limits. Activity Manage a fitness experience made for younger users. App Store Allow automatic downloads and updates. Contacts Choose trusted contacts. Find My Choose notification settings. Handwashing Manage restrictions, and turn the handwashing timer on or off. Health Add or edit health details and Medical ID, view the health data (with the proper permissions and settings) of the person who uses the managed Apple Watch, request to share health data, and choose to stop receiving health data.","289, 288, 283, 284, 43",entailment,GROUNDED,0.9714,0.0257,0.0029
apple_watch_Q039,apple_watch.pdf,Specification Lookup,What is the typical Bluetooth range within which an iPhone must be to unlock an Apple Watch automatically?,about 33 feet or 10 meters,"to USB-C Cable, Apple Watch Magnetic Charging Cable, and Apple Watch Magnetic Charging Dock The radiated output power of this device meets the limits of FCC/IC radio frequency exposure limits. This device should be operated with a minimum separation distance of 20 cm (8 inches) between the equipment and a person’s body. La puissance de sortie rayonnée de cet appareil est conforme aux limites de la FCC/IC limites d'exposition aux fréquences radio. Cet appareil doit être utilisé avec une distance minimale de séparation de 20 cm entre l’appareil et le corps d’une personne.","289, 156, 204, 30, 63, 84",entailment,GROUNDED,0.9956,0.0044,0.0
apple_watch_Q042,apple_watch.pdf,Tool/Material Identification,What type of cloth should be used to clean the Apple Watch?,"nonabrasive, lint-free cloth","Apple Watch User Guide Important handling information for Apple Watch Exposure to liquid Apple Watch is water resistant but not waterproof. You may, for example, wear and use Apple Watch during exercise (exposure to sweat is OK), in the rain, and while washing your hands. If water splashes onto the watch, wipe it off with a nonabrasive, lint-free cloth. Try to minimize exposing Apple Watch to perfume, soap, solvents, detergent, acids or acidic foods, soapy water, insect repellent, lotions, sunscreen, oil, or hair dye. Follow the instructions below in the “Cleaning and care” section if Apple Watch comes into contact with them.","286, 285, 288, 38",neutral,UNCERTAIN,0.0283,0.9717,0.0
apple_watch_Q044,apple_watch.pdf,Tool/Material Identification,"What is needed to listen to most audio, like music or podcasts, on Apple Watch without an iPhone nearby?",Bluetooth headphones or speakers,"to Bluetooth headphones or speakers, open the Audiobooks app on your Apple Watch. 2. Turn the Digital Crown to scroll through the artwork. 3. Tap an audiobook to play it. Play audiobooks on iPhone 1. Open the Audiobooks app on your Apple Watch. 2. Tap On iPhone. 3. Tap an audiobook to play it on your iPhone.","80, 16, 149, 85, 205, 217, 216",entailment,GROUNDED,0.9901,0.0092,0.0007
apple_watch_Q047,apple_watch.pdf,Procedural Step Inquiry,What are the steps to unpair my Apple Watch from my iPhone?,"1. Open the Apple Watch app on your iPhone.\n2. Tap My Watch, then tap All Watches at the top of the screen.\n3. Tap next to the Apple Watch you want to unpair, then tap Unpair Apple Watch.","Apple Watch User Guide Unpair Apple Watch 1. Open the Apple Watch app on your iPhone. 2. Tap My Watch, then tap All Watches at the top of the screen. 3. Tap next to the Apple Watch you want to unpair, then tap Unpair Apple Watch. Pair more than one Apple Watch You can pair another Apple Watch in the same way you paired your first one. Bring your iPhone near your Apple Watch, wait for the Apple Watch pairing screen to appear on your iPhone, then tap Pair. Or follow these steps: 1. Open the Apple Watch app on your iPhone.","21, 277, 278, 275",entailment,GROUNDED,0.9955,0.0042,0.0003
apple_watch_Q048,apple_watch.pdf,Procedural Step Inquiry,How can I change the passcode on my Apple Watch directly?,"1. Open the Settings app on your Apple Watch.\n2. Tap Passcode, then tap Change Passcode and follow the onscreen prompts.","Apple Watch User Guide Erase Apple Watch In some cases, you may need to erase your Apple Watch—if you forgot your passcode, for example. Erase Apple Watch and settings 1. Open the Settings app on your Apple Watch. 2. Go to General > Reset, tap Erase All Content and Settings, then enter your passcode. If you have an Apple Watch with a cellular plan, you’re offered two options—Erase All and Erase All & Keep Plan. To completely erase your Apple Watch, choose Erase All. If you want to erase and then restore it with your cellular plan in place, choose Erase All & Keep Plan.","31, 276, 275",neutral,UNCERTAIN,0.4993,0.4998,0.0009
apple_watch_Q053,apple_watch.pdf,Location/Definition,Where can the serial number of the Apple Watch be found?,"On your Apple Watch, open the Settings app, then go to General > About.","Apple Watch User Guide Get information about Apple Watch See information about Apple Watch On your Apple Watch, open the Settings app , then go to General > About. The items you can view include: • Name • Software version • Model number • Serial number • Number of songs, photos, and apps • Capacity and available storage space • Network • Carrier—Apple Watch with cellular only • IMEI, ICCID, MEID • MAC and Bluetooth addresses • Modem firmware—Apple Watch with cellular only • SEID and EID • Legal Info To view regulatory marks, open the Settings app , then go to General > Regulatory.","33, 23, 57, 43, 173, 280, 279, 165, 278",entailment,GROUNDED,0.9702,0.0159,0.0139
apple_watch_Q054,apple_watch.pdf,Location/Definition,What is Taptic Time?,"When Apple Watch is in silent mode, it can tap out the time on your wrist with a series of distinct taps.","Apple Watch User Guide Tell time with haptic feedback on Apple Watch When it’s in silent mode, Apple Watch can tap out the time on your wrist with a series of distinct taps. Do the following: 1. Open the Settings app on your Apple Watch. 2. Tap Clock, scroll up, then tap Taptic Time. 3. Turn on Taptic Time, then choose a setting—Digits, Terse, or Morse Code. Hours and minutes are indicated in the following ways: • Digits: Apple Watch long taps for every 10 hours, short taps for each following hour, long taps for every 10 minutes, then short taps for each following minute.","70, 268, 58, 65",entailment,GROUNDED,0.9974,0.0026,0.0001
apple_watch_Q059,apple_watch.pdf,Conditional Logic/Causal Reasoning,What happens if Apple Watch SE or Series 4 (or later) detects a hard fall and the user is immobile for about a minute?,"it will tap your wrist, sound an alarm, and then attempt to call emergency services.","Apple Watch User Guide Manage fall detection on Apple Watch (Apple Watch SE and Apple WatchSeries 4 and later only) With fall detection enabled, if Apple Watch SE or Apple Watch Series 4 or later detects a hard fall, it can help connect you to emergency services and send a message to your emergency contacts. If Apple Watch detects a hard fall and that you have been immobile for about a minute, it will tap your wrist, sound an alarm, and then attempt to call emergency services. If the birthdate you enter when setting up your Apple Watch (or adding it to the Health app on iPhone) indicates that you’re 55 or older, fall detection is turned on automatically.","209, 146, 70, 77, 31",neutral,UNCERTAIN,0.1453,0.8545,0.0001
apple_watch_Q062,apple_watch.pdf,Safety Information Lookup,What high-velocity water activities should Apple Watch Series 3 and later *not* be used for?,"scuba diving, water skiing, or other activities involving high velocity water or submersion below shallow depth.","Apple Watch User Guide Important handling information for Apple Watch Exposure to liquid Apple Watch is water resistant but not waterproof. You may, for example, wear and use Apple Watch during exercise (exposure to sweat is OK), in the rain, and while washing your hands. If water splashes onto the watch, wipe it off with a nonabrasive, lint-free cloth. Try to minimize exposing Apple Watch to perfume, soap, solvents, detergent, acids or acidic foods, soapy water, insect repellent, lotions, sunscreen, oil, or hair dye. Follow the instructions below in the “Cleaning and care” section if Apple Watch comes into contact with them.","285, 121, 284",neutral,UNCERTAIN,0.0382,0.9606,0.0012
apple_watch_Q063,apple_watch.pdf,Safety Information Lookup,What are some potential causes of skin sensitivity reactions when wearing Apple Watch?,"allergies, environmental factors, extended exposure to irritants like soap, sweat, or other causes.","water, including those that may lead to skin irritation such as sweat, salt water, soapy water, pool water, perfume, insect repellent, lotions, sunscreen, oil, adhesive remover, hair dye, or solvents. The Apple Watch and band colors may vary or fade over time. After swimming with Apple Watch Series 3, Apple Watch Series 4, Apple Watch Series 5, Apple Watch SE, Apple Watch Series 6, and Apple Watch Series 7, gently rinse it with warm tap water.","284, 285",entailment,GROUNDED,0.9821,0.0171,0.0008
bosch_oven_Q001,bosch_oven.pdf,Specification Lookup,What is the specified minimum distance that wearers of electronic implants must maintain from the control panel due to permanent magnets?,at least 10 cm,"in the control elements. They may affect electronic implants, e.g. heart pacemakers or insulin pumps. Wearers of electronic implants must stay at least 10 cm away from the control panel. Halogen lamp :Warning – Risk of electric shock! When replacing the cooking compartment bulb, the bulb socket contacts are live. Before replacing the bulb, unplug the appliance from the mains or switch off the circuit breaker in the fuse box. Cleaning function :Warning – Risk of burns! ; The appliance will become very hot on the outside during the cleaning function. Never touch the appliance door. Allow the appliance to cool down.","39, 30, 3, 11, 5, 7, 25",entailment,GROUNDED,0.9889,0.0108,0.0004
