question_id,doc_id,category,question,answer,retrieved_context,retrieved_pages,nli_label,verdict,entailment,neutral,contradiction
laptop_lenovo_tc_x1_Q046,laptop_lenovo_tc_x1.pdf,Specification Lookup,What is the optimal operating air temperature range?,10°C–35°C (50°F–95°F),Specifications This section lists the physical specifications for your computer. Dimensions (without a computer stand base) Width: 570 mm (22.4 inches) Height: 450 mm (17.7 inches) Depth: 100 mm (3.9 inches) Weight (without the package) Maximum configuration as shipped: 5 kg (11 lb) Environment • Air temperature: Operating: From 10°C (50°F) to 35°C (95°F) Storage in original shipping package: From -40°C (-40°F) to 60°C (140°F) Storage without package: From -10°C (14°F) to 60°C (140°F) • Humidity: Operating: 20%–80% (non-condensing) Storage: 20%–90% (non-condensing) • Altitude: Operating: From -15.2 m (-50 ft) to 3048 m (10 000 ft) Storage: From -15.2 m (-50 ft) to 10 668 m (35 000 ft) Electrical input Input voltage: From 100 V ac to 240 V ac Input frequency: 50/60 Hz Programs This section provides information about the programs on the computer.,"8, 72, 20, 3, 27",entailment,GROUNDED,0.9461,0.0475,0.0064
laptop_lenovo_tc_x1_Q048,laptop_lenovo_tc_x1.pdf,Conditional Logic/Causal Reasoning,What happens if I put the computer inside a cabinet or other furniture?,this might increase the risk of overheating.,"from vents and any perforations in the bezel. More frequent cleanings might be required for computers in dusty or high-traffic areas. • Do not restrict or block any ventilation openings. • Do not store or operate the computer inside furniture, as this might increase the risk of overheating. • Airflow temperatures into the computer should not exceed 35°C (95°F). • Do not install air filtration devices. They may interfere with proper cooling. Operating environment The optimal environment in which to use the computer is 10°C–35°C (50°F–95°F) with humidity ranging between 35% and 80%. If the computer is stored or transported in temperatures less than 10°C (50°F), allow the cold computer to rise slowly to an optimal operating temperature of 10°C–35°C (50°F–95°F) before use.","8, 6, 27, 57, 9, 31",entailment,GROUNDED,0.5296,0.4703,0.0001
laptop_lenovo_tc_x1_Q057,laptop_lenovo_tc_x1.pdf,Tool/Material Identification,What should I use to clean the painted surfaces of the computer?,only mild cleaning solutions and a damp cloth,"documentation through a screen reader. Each image in the documentation also includes adequate alternative text so that visually impaired users can understand the image when they use a screen reader. Cleaning the computer CAUTION: Remove any media from the drives and turn off all connected devices and the computer. Then, disconnect all power cords from electrical outlets and disconnect all cables that are connected to the computer. It is a good practice to clean the computer periodically to protect the surfaces and ensure trouble-free operation. Use only mild cleaning solutions and a damp cloth to clean the painted surfaces of the computer.","31, 9, 8",entailment,GROUNDED,0.9725,0.0274,0.0001
laptop_lenovo_tc_x1_Q062,laptop_lenovo_tc_x1.pdf,Procedural Step Inquiry,What is the procedure for backing up data using File History in Windows 10?,"Right-click the Start button to open the Start context menu, and then click **Control**\n**Panel** . View Control Panel using large icons or small icons, and then click **File History** . Follow the\ninstructions on the screen.","– Use recovery solutions in Windows Settings. 1. Click the Start button to open the Start menu. 2. Click Settings ➙Update & security ➙Recovery. 3. Choose the appropriate recovery solution by following the instructions on the screen. – Use System Restore to restore system files and settings to an earlier point. 1. Click the Start button to open the Start menu, and then click Windows System ➙Control Panel. 2. View Control Panel using large icons or small icons, and then click Recovery ➙Open System Restore. 3. Follow the instructions on the screen. – Use the File History tool to restore your files from a backup.","29, 32, 56, 17, 20, 55",neutral,UNCERTAIN,0.2764,0.72,0.0036
laptop_lenovo_tc_x1_Q063,laptop_lenovo_tc_x1.pdf,Conditional Logic/Causal Reasoning,What is the consequence of blocking the air vents?,"Blocking the air vents can cause overheating, which might result in a malfunction or damage.","high-powered speakers, air conditioner, and microwave oven away from the computer because the strong magnetic fields generated by these appliances can damage the monitor and data on the storage drive. Do not place any beverages on top of or beside the computer or other connected devices. If liquid is spilled on or in the computer or a connected device, a short circuit or other damage might occur. Do not eat or smoke over your keyboard. Particles that fall into your keyboard can cause damage. Power supply statement Never remove the cover on a power supply or any part that has the following label attached.","27, 31, 8, 71",neutral,UNCERTAIN,0.009,0.9909,0.0001
laptop_lenovo_tc_x1_Q084,laptop_lenovo_tc_x1.pdf,Procedural Step Inquiry,How do I disable the Fast Startup function in Windows 10?,"1. Click the Start button to open the Start menu, and then click **Windows System** ➙ **Control Panel** .\n\n2. Select **All Control Panel Items** ➙ **Power Options** .\n\n3. Select **Choose what the power buttons do** from the pop-up dialog box.\n\n4. Select the **Change settings that are currently unavailable** option, and clear the **Turn on fast startup**\noption from the **Shutdown settings** list.","requirement of ErP compliance. To disable the Fast Startup function, do the following: 1. Click the Start button to open the Start menu, and then click Windows System ➙Control Panel. 2. Select All Control Panel Items ➙Power Options. 3. Select Choose what the power buttons do from the pop-up dialog box. 4. Select the Change settings that are currently unavailable option, and clear the Turn on fast startup option from the Shutdown settings list. Enabling or disabling the Configuration Change Detection feature If you enable the Configuration Change Detection feature, when the POST detects the configuration changes of some hardware devices (such as storage drives or memory modules), an error message will be displayed when you turn on the computer.","40, 81, 43",neutral,UNCERTAIN,0.1031,0.8965,0.0005
laptop_lenovo_tc_x1_Q085,laptop_lenovo_tc_x1.pdf,Procedural Step Inquiry,How do I connect to a wireless network?,1. Ensure that a wireless LAN is available and the wireless LAN feature on the computer is working.\n\n2. Click the wireless-network-connection-status icon in the Windows notification area to display available\nwireless networks.,"LAN feature is optional. To establish a wireless-LAN connection, do the following: 1. Ensure that a wireless LAN is available and the wireless LAN feature on the computer is working. 2. Click the wireless-network-connection-status icon in the Windows notification area to display available wireless networks. Note: If the wireless-network-connection-status icon is not displayed in the Windows notification area, add the icon to the notification area. See “Adding an icon to the Windows notification area” on page 14. ThinkCentre X1 User Guide","24, 51, 50, 25",entailment,GROUNDED,0.6593,0.3403,0.0004
laptop_lenovo_tc_x1_Q092,laptop_lenovo_tc_x1.pdf,Conditional Logic/Causal Reasoning,What is the risk if someone connects a telephone cable to the Ethernet connector?,risk of electrical shock,"might damage the computer, data, or connected devices. Some products are equipped with a three-pronged plug. This plug fits only into a grounded electrical outlet. This is a safety feature. Do not defeat this safety feature by trying to insert it into a non-grounded outlet. If you cannot insert the plug into the outlet, contact an electrician for an approved outlet adapter or to replace the outlet with one that enables this safety feature. Never overload an electrical outlet. The overall system load should not exceed 80 percent of the branch circuit rating. Consult an electrician for more information if you have questions about power loads and branch circuit ratings.","57, 7, 6, 24, 50, 14",neutral,UNCERTAIN,0.0525,0.9474,0.0
laptop_lenovo_tc_x1_Q096,laptop_lenovo_tc_x1.pdf,Safety Information Lookup,"What is the primary safety concern mentioned regarding ""Plugs and outlets""?","If a receptacle (power outlet) that you intend to use with the computer equipment appears to be damaged or\ncorroded, do not use the outlet until it is replaced by a qualified electrician.","Japanese power cord and power adapter description Extension cords and related devices Ensure that extension cords, surge protectors, uninterruptible power supplies, and power strips that you use are rated to handle the electrical requirements of the product. Never overload these devices. If power strips are used, the load should not exceed the power strip input rating. Consult an electrician for more information if you have questions about power loads, power requirements, and input ratings. Plugs and outlets If a receptacle (power outlet) that you intend to use with the computer equipment appears to be damaged or corroded, do not use the outlet until it is replaced by a qualified electrician.","7, 57, 6, 3",neutral,UNCERTAIN,0.0991,0.9009,0.0
laptop_lenovo_tc_x1_Q100,laptop_lenovo_tc_x1.pdf,Safety Information Lookup,What is the specific danger of connecting external device cables (other than USB) while the computer is on?,you might damage the computer.,"overall system load should not exceed 80 percent of the branch circuit rating. Consult an electrician for more information if you have questions about power loads and branch circuit ratings. Be sure that the power outlet you are using is properly wired, easily accessible, and located close to the equipment. Do not fully extend power cords in a way that will stress the cords. Be sure that the power outlet provides the correct voltage and current for the product you are installing. Carefully connect and disconnect the equipment from the electrical outlet. External devices Do not connect or disconnect any external device cables other than Universal Serial Bus (USB) cables while the computer power is on; otherwise, you might damage the computer.","6, 8, 9, 57, 7, 45, 65",entailment,GROUNDED,0.9944,0.0055,0.0001
laptop_lenovo_tc_x1_Q112,laptop_lenovo_tc_x1.pdf,Specification Lookup,What is the maximum allowable airflow temperature into the computer?,Airflow temperatures into the computer should not exceed 35°C (95°F).,"from vents and any perforations in the bezel. More frequent cleanings might be required for computers in dusty or high-traffic areas. • Do not restrict or block any ventilation openings. • Do not store or operate the computer inside furniture, as this might increase the risk of overheating. • Airflow temperatures into the computer should not exceed 35°C (95°F). • Do not install air filtration devices. They may interfere with proper cooling. Operating environment The optimal environment in which to use the computer is 10°C–35°C (50°F–95°F) with humidity ranging between 35% and 80%. If the computer is stored or transported in temperatures less than 10°C (50°F), allow the cold computer to rise slowly to an optimal operating temperature of 10°C–35°C (50°F–95°F) before use.","8, 31, 20",entailment,GROUNDED,0.7616,0.2383,0.0001
laptop_lenovo_tc_x1_Q115,laptop_lenovo_tc_x1.pdf,Specification Lookup,What is the adjustment range for the Orchid Tilt Stand?,between 5° to the front and 45° to the rear,"1 Orchid Tilt Stand base 2 Orchid Tilt Stand 3 Slide cover 4 Memory module shield 5 Bottom cover 6 I/O shield 7 Integrated camera 8 Computer cover 9 LCD panel 10 Cover presence switch (also known as intrusion switch) 11 I/O bracket 12 Card reader 13 I/O board 14 Storage drive 15 Storage drive bracket 16 Internal speakers (2) 17 Wi-Fi antennas (2) 18 VESA mount bracket 19 Memory module 20 Heat sink 21 Coin-cell battery 22 LED board 23 Control button board 24 Control button board bezel 25 Wi-Fi card 26 System fan 27 System board shield 28 Power cord 29 Power adapter Parts on the system board Note: For the parts that are displayed on the following figure but not introduced in the following table, see “Front view” on page 1 and “Rear view” on page 3.","28, 23, 27, 49, 64, 63, 16",neutral,UNCERTAIN,0.4306,0.5431,0.0263
laptop_lenovo_tc_x1_Q117,laptop_lenovo_tc_x1.pdf,Tool/Material Identification,What type of battery is listed as component 21 in the computer components diagram?,Coin-cell battery,"1 Orchid Tilt Stand base 2 Orchid Tilt Stand 3 Slide cover 4 Memory module shield 5 Bottom cover 6 I/O shield 7 Integrated camera 8 Computer cover 9 LCD panel 10 Cover presence switch (also known as intrusion switch) 11 I/O bracket 12 Card reader 13 I/O board 14 Storage drive 15 Storage drive bracket 16 Internal speakers (2) 17 Wi-Fi antennas (2) 18 VESA mount bracket 19 Memory module 20 Heat sink 21 Coin-cell battery 22 LED board 23 Control button board 24 Control button board bezel 25 Wi-Fi card 26 System fan 27 System board shield 28 Power cord 29 Power adapter Parts on the system board Note: For the parts that are displayed on the following figure but not introduced in the following table, see “Front view” on page 1 and “Rear view” on page 3.","77, 72, 3, 15, 9, 16",entailment,GROUNDED,0.6413,0.3507,0.008
laptop_lenovo_tc_x1_Q119,laptop_lenovo_tc_x1.pdf,Tool/Material Identification,What can I install if I have insufficient free memory space?,additional memory modules,"To purchase memory modules, go to http://www.lenovo.com. Serial connector cannot be accessed Solutions: • Connect the serial cable to the serial connector on the computer and to the serial device. If the serial device has its own power cord, connect the power cord to a grounded electrical outlet. • Turn on the serial device and keep the device online. • Install any application programs supplied with the serial device. Refer to the documentation that comes with the serial device for more information. • If you added one serial-connector adapter, install the adapter correctly. USB device problems This section provides solutions to USB device-related problems.","62, 61, 72, 53, 52, 32",entailment,GROUNDED,0.992,0.0075,0.0005
laptop_lenovo_tc_x1_Q122,laptop_lenovo_tc_x1.pdf,Location/Definition,What is the DisplayPort connector used for?,Used to send or receive audio and video signals.,"storage drive space, do the following: 1. Depending on your Windows version, do one of the following: • For Windows 7: Click the Start button to open the Start menu. Right-click Computer, and then click Manage. • For Windows 10: Right-click the Start button to open the Start context menu. 2. Click Disk Management. Video feature The integrated graphics card supports the DisplayPort connector on your computer. Audio features The integrated audio card supports the following audio connectors and devices on your computer: • Headset connector • Integrated microphone • Internal speaker Input/Output (I/O) features • Audio connectors (headset connector and microphone connector) • Card reader slot (optional) • DisplayPort connector • Ethernet connector • USB connector Expansion • Card reader slot (optional) • Memory slot • Storage drive bay Network features • Ethernet LAN • Wireless LAN • Bluetooth Security features For more information, see Chapter 4 “Security” on page 25.","14, 12, 13, 16, 18",entailment,GROUNDED,0.9965,0.0034,0.0001
laptop_lenovo_tc_x1_Q125,laptop_lenovo_tc_x1.pdf,Location/Definition,What is the name of the diagnostic program preinstalled on the computer?,Lenovo Solution Center,"To recover your Windows 7 operating system, use the following solutions: • Use Windows recovery solutions. – Use System Restore to restore system files and settings to an earlier point. 1. Click the Start button to open the Start menu. ThinkCentre X1 User Guide","54, 5, 4, 22, 3, 45",neutral,UNCERTAIN,0.0535,0.8254,0.1212
lg_home_theater_Q002,lg_home_theater.pdf,Specification Lookup,What is the maximum input power for the speakers?,160 W,. . . . . . . . . . . . . . .15 Operation General features . . . . . . . . . . . . . . . . . . . . . . . . .16 Additional features . . . . . . . . . . . . . . . . . . . . . . .17 Playing an Audio CD or MP3/WMA file . . . . . .18 Programmed Playback . . . . . . . . . . . . . . . . .,"28, 20, 4, 5",entailment,GROUNDED,0.5951,0.3189,0.086
lg_home_theater_Q003,lg_home_theater.pdf,Specification Lookup,How much does the main unit weigh?,3.31 kg,"General CD/DVD Amplifier Speakers Tuner FM AM [MW] Specifications Video Power supply Refer to main label Power consumption Refer to main label Net Weight 3.31 kg External dimensions (W x H x D) 170 x 253 x 265 mm Operating conditions Temperature: 5°C to 35°C, Operation status: Horizontal Operating humidity 5% to 85% Laser Semiconductor laser, wavelength 650 nm Signal system NTSC 525/60 Frequency response (audio) 40 Hz to 2 kHz Signal-to-noise ratio (audio) More than 75 dB (1 kHz, NOP -3 dB, 20 kHz LPF/A-Filter) Dynamic range (audio) More than 75 dB Harmonic distortion (audio) 0.5 % (1 kHz, at 1W position) (20 kHz LPF) Video output 1.0 V (p-p), 75 Ω, negative sync./ RCA jack x 1 COMPONENT VIDEO OUT (Y) 1.0 V (p-p), 75 ohms, negative sync, RCA jack x 1 (Pb)/(Pr) 0.7 V (p-p), 75 ohms, RCA jack x 1 Tuning Range 87.5 - 108.0 MHz or 65.0 - 74.0 MHz, 87.5 - 108.0 MHz Intermediate Frequency 10.7 MHz Signal-to Noise Ratio 60/55 dB (Mono) Frequency Response 50 - 10,000 Hz Tuning Range 522 - 1,620 kHz or 520 - 1,720 kHz Intermediate Frequency 450 kHz Stereo mode 80 W + 80 W Output Power 80 W + 80 W T.H.D 0.5 % Frequency Response 40 - 20000 Hz Signal-to-noise ratio 75 dB Type 3 Way 3 Speaker Impedance 4 Ω Frequency Response 70 - 20,000 Hz Sound Pressure Level 83 dB/W (1m) Rated Input Power 80 W Max.","28, 20, 4",entailment,GROUNDED,0.9525,0.0249,0.0226
lg_home_theater_Q004,lg_home_theater.pdf,Specification Lookup,What is the supported sampling frequency range for WMA files?,within 24 - 48kHz (WMA),"over 30 per 1 second, this unit may not operate normally. • If the video and audio structure of recorded files is not interleaved, either video or audio is outputted. Playable DivX file • "".avi "", "".mpg "", "".mpeg "", "".divx"" Playable Subtitle format SubRip(*.srt/*.txt) SAMI(*.smi) SubStation Alpha(*.ssa/*.txt) MicroDVD(*.sub/*.txt) SubViewer 2.0(*.sub/*.txt) VobSub(*.sub) Playable Codec format • ""DIVX3.xx "", ""DIVX4.xx "", ""DIVX5.xx "", ""MP43 "", ""3IVX "". Playable Audio format • ""AC3 "", ""PCM "", ""MP3 "", ""WMA "". • Sampling frequency: within 32 - 48 kHz (MP3), within 24 - 48kHz (WMA) • Bit rate: within 32 - 320kbps (MP3), 40 - 192kbps (WMA)","20, 4, 18",neutral,UNCERTAIN,0.1503,0.7534,0.0964
lg_home_theater_Q007,lg_home_theater.pdf,Tool/Material Identification,What type of cable is required for a Component Video connection?,a Y Pb Pr cable,"Front Panel/ Back Panel 1. 1 (POWER) 2. VOLUME* 3. FUNC. (FUNCTION) (FM, AM, DVD/CD, USB, AUX, OSD iPod) 4. .(SKIP) TUN. (-) (TUNER) 5. XTS pro 6. x (STOP) MO./ ST. (MONO/ STEREO) 7. DISC TRAY 8. EQ master/ DEMO button 9. CLOCK button 10. TIMER button 11. SET button 12. PHONES (Headphone jack : 3.5mm) 13. MIC1/ MIC2 (MIC Jacks) 14. USB connector 15. Z (OPEN/CLOSE) 16. > (SKIP) TUN. (+) (TUNER) 17. XDSS plus / (MP3 Optimizer) 18. B/[] (PLAY/PAUSE) 19. Display window 20. Power cord 21. Antenna terminal 22. AUX IN (Auxiliary input) connector 23. COMPONENT VIDEO OUT (PROGRESSIVE SCAN) connector (Y Pb Pr) 24.","8, 10, 26, 6, 13",entailment,GROUNDED,0.725,0.1888,0.0863
lg_home_theater_Q009,lg_home_theater.pdf,Tool/Material Identification,What do I need to connect my iPod to the back of the home theater?,an iPod cable,"- 14, MAX steps) Note: • When not using the microphone, set the MIC VOL. to minimum or turn off the MICs and remove the microphone from the MIC Jacks. • If the microphone is set too near the speaker, a howling sound may be produced. In this case, move the microphone away from the speaker or decrease the sound level by using MIC VOL.. • If sound through the microphone is extremely loud, it may be distorted. In this case, decrese MIC volume. iPod connection Connect the iPod connector on the rear of the unit to the dock connector of iPod using an iPod cable (I).","9, 21, 6, 4",entailment,GROUNDED,0.9918,0.008,0.0002
lg_home_theater_Q011,lg_home_theater.pdf,Procedural Step Inquiry,How do I set the clock?,1. Press**CLOCK**.\\n2. Select a 24 hour time system or a 12 hour time\\nsystem by tapping./\>.\\n3. Press**SET** to confirm the selected hour time\\nsystem.\\n4. Tap./\> on the front panel to set the correct\\nhours.\\n5. Press**SET**.\\n6. Tap./\> on the front panel to set the correct\\nminutes.\\n7. Press**SET** and the correct time is shown on the\\ndisplay window.,"60 → 50 → 40 → 30 →20 → 10 → OFF (No display) Note: If you press SLEEP while the sleep time is displayed, the SLEEP time is reset. To cancel the sleep timer mode If you have to stop the function, press the SLEEP repeatedly until “SLEEP 10” appears, and then press SLEEP once again while “SLEEP 10” is displayed. (12HR) (24HR) or","11, 4",contradiction,HALLUCINATION,0.1577,0.3347,0.5076
lg_home_theater_Q017,lg_home_theater.pdf,Location/Definition,What does the 'Panscan' display mode do?,Automatically displays the wide picture\\non the entire screen and cuts off the\\nportions that do not fit.,"highest quality pictures with less flickering. If you are using the COMPONENT VIDEO OUT jacks, but are connecting the unit to a standard (analog) television, set Progressive Scan to Off. If you are using the Component Video jacks for connection to a TV or monitor that is compatible with a progressive scan signal, set Progressive Scan to On. To Turn ON progressive scan: Connect component out of the unit to the input of your monitor/television, set your television or monitor to Component Input. 1. Select “Progressive Scan” on the DISPLAY menu then press B. 2. Select “On” using v / V.","4, 13, 19",neutral,UNCERTAIN,0.0778,0.9186,0.0036
lg_home_theater_Q023,lg_home_theater.pdf,Conditional Logic/Causal Reasoning,What happens if I press 'SLEEP' while the sleep time is already displayed?,the SLEEP time is reset.,"or check the timer, press the TIMER that “ ” appears in the display window. To cancel the TIMER, press the TIMER that “ ” disappears in the display window. Sleep Timer Function When the sleep timer is used, the power is automatically turned off after the specified time has elapsed. 1. Press SLEEP to set the desired sleep time. The SLEEP indicator and sleep time appears in the display window. 2. Each time you press SLEEP the setting changes in the following order. SLEEP 180 → 150 → 120 →90 →80 → 70 → 60 → 50 → 40 → 30 →20 → 10 → OFF (No display) Note: If you press SLEEP while the sleep time is displayed, the SLEEP time is reset.","11, 4",neutral,UNCERTAIN,0.3369,0.6472,0.016
lg_home_theater_Q026,lg_home_theater.pdf,Safety Information Lookup,What is the warning about installing this equipment in a confined space like a bookcase?,\*\*WARNING:\*\*Do not install this equipment in a confined space\\nsuch as a bookcase or similar unit.,This lightning flash with arrowhead symbol within an equilateral triangle is intended to alert the user to the presence of uninsulated dangerous voltage within the product’s enclosure that may be of sufficient magnitude to constitute a risk of electric shock to persons. The exclamation point within an equilateral triangle is intended to alert the user to the presence of important operating and maintenance (servicing) instructions in the literature accompanying the product. WARNING: Do not install this equipment in a confined space such as a bookcase or similar unit. CAUTION: Do not block any ventilation openings. Install in accordance with the manufacturer's instructions.,"2, 3",entailment,GROUNDED,0.4699,0.0789,0.4512
lg_home_theater_Q038,lg_home_theater.pdf,Safety Information Lookup,What is the potential hazard if I remove the cabinet cover?,"DO NOT REMOVE THE CABINET COVER, OR YOU MAY BE EXPOSED TO DANGEROUS VOLTAGE.","this product will protect you if you observe the following procedures for installation, use, and servicing. This product does not contain any parts that can be repaired by the user. DO NOT REMOVE THE CABINET COVER, OR YOU MAY BE EXPOSED TO DANGEROUS VOLTAGE. REFER SERVICING TO QUALIFIED SERVICE PERSONNEL ONLY.","3, 2",neutral,UNCERTAIN,0.0154,0.9845,0.0001
