question_id,doc_id,category,question,answer,retrieved_context,retrieved_pages,nli_label,verdict,entailment,neutral,contradiction
omron_monitor_Q027,omron_monitor.pdf,Safety Information Lookup,What instruction is given regarding the AC adapter and the voltage outlet?,Plug the AC adapter into the appropriate voltage outlet.,"months or more. • Do not use new and used batteries together. General Precautions • Do not apply strong shocks and vibrations to or drop the unit and arm cuff. • Do not take measurements after bathing, drinking alcohol, smoking, exercising or eating. • Do not forcibly bend the arm cuff or bend the air tube excessively. • When removing the air tube, pull on the air plug at the connection with the main unit not the tube itself. • Do not inflate the arm cuff when it is not wrapped around your arm. • Do not wash the arm cuff or immerse it in water.","4, 20, 3, 2",entailment,GROUNDED,0.8473,0.149,0.0037
omron_monitor_Q037,omron_monitor.pdf,Specification Lookup,What is the specified accuracy for pressure readings on the HEM-7200-E model?,Pressure: ± 3mmHg,"Check following components! Vériﬁer les composants suivants ! Prüfen Sie folgende Teile des Lieferumfangs! Controllare i componenti indicati di seguito! ¡Compruebe los siguientes componentes! Controleer de volgende onderdelen! Проверьте следующие компоненты! Digital Automatic Blood Pressure Monitor Model M3 Instruction Manual English Français Deutsch Italiano Español Nederlands IM-HEM-7200-E-05-11/2010 5329491-4C Manufacturer OMRON HEALTHCARE Co., Ltd. 24, Yamanouchi Yamanoshita-cho, Ukyo-ku, Kyoto 615-0084 JAPAN EU-representative OMRON HEALTHCARE EUROPE B.V. Kruisweg 577, 2132 NA Hoofddorp THE NETHERLANDS www.omron-healthcare.com Production facility Site de production Produktionsstätte Stabilimento di produzione Oﬁcina de producción Productiefaciliteit Производственное подразделение OMRON (DALIAN) CO., LTD. Economic & Technical Development Zone Dalian 116600, CHINA OMRON HEALTHCARE UK LIMITED Opal Drive Fox Milne Milton Keynes, MK15 0DG U.K.","21, 10, 26, 16, 22, 1, 18",entailment,GROUNDED,0.5044,0.4797,0.0159
omron_monitor_Q047,omron_monitor.pdf,Procedural Step Inquiry,What are the final two steps to complete a blood pressure measurement session after the device finishes reading?,2. Remove the arm cuff.\n3. Press the O/I START button to turn off the monitor.,Refer to section 3.1. Clothing is interfering with the arm cuff. Remove any clothing interfering with the arm cuff. Refer to section 3.1. Air is leaking from the arm cuff. Replace cuff with new one. Refer to Chapter 5. The arm cuff was inflated above 299 mmHg when inflating the cuff manually. Do not inflate the arm cuff above 299 mmHg. Refer to section 3.3. Device error. Contact your OMRON retail outlet or distributor. Error Display Cause Remedy,"11, 18, 10, 20, 15, 9, 2",neutral,UNCERTAIN,0.0078,0.9761,0.0161
omron_monitor_Q049,omron_monitor.pdf,Procedural Step Inquiry,What instruction is given regarding clothing when applying the arm cuff for a measurement?,Removetightfittingclothingortightrolledupsleevefromyourupperarm,4. Troubleshooting and Maintenance EN Note: The irregular heartbeat symbol ( ) may also be displayed with error messages. Cuff is under inflated. Carefully read and repeat the steps listed under section 3.3. Movement during measurement. Repeat measurement. Remain still and do not talk during measurement. Refer to section 3.3. Air plug disconnected. Insert the air plug securely. Refer to section 3.1. Arm cuff not applied correctly. Apply the arm cuff correctly. Refer to section 3.1. Clothing is interfering with the arm cuff. Remove any clothing interfering with the arm cuff. Refer to section 3.1. Air is leaking from the arm cuff.,"3, 15, 18, 2, 16, 8, 9",neutral,UNCERTAIN,0.0035,0.5907,0.4059
omron_monitor_Q054,omron_monitor.pdf,Location/Definition,"Where is the manufacturer OMRON HEALTHCARE Co., Ltd. located?","24, Yamanouchi Yamanoshita-cho, Ukyo-ku, Kyoto 615-0084 JAPAN","Check following components! Vériﬁer les composants suivants ! Prüfen Sie folgende Teile des Lieferumfangs! Controllare i componenti indicati di seguito! ¡Compruebe los siguientes componentes! Controleer de volgende onderdelen! Проверьте следующие компоненты! Digital Automatic Blood Pressure Monitor Model M3 Instruction Manual English Français Deutsch Italiano Español Nederlands IM-HEM-7200-E-05-11/2010 5329491-4C Manufacturer OMRON HEALTHCARE Co., Ltd. 24, Yamanouchi Yamanoshita-cho, Ukyo-ku, Kyoto 615-0084 JAPAN EU-representative OMRON HEALTHCARE EUROPE B.V. Kruisweg 577, 2132 NA Hoofddorp THE NETHERLANDS www.omron-healthcare.com Production facility Site de production Produktionsstätte Stabilimento di produzione Oﬁcina de producción Productiefaciliteit Производственное подразделение OMRON (DALIAN) CO., LTD. Economic & Technical Development Zone Dalian 116600, CHINA OMRON HEALTHCARE UK LIMITED Opal Drive Fox Milne Milton Keynes, MK15 0DG U.K.","1, 2, 23, 17, 22",entailment,GROUNDED,0.98,0.0185,0.0015
omron_monitor_Q055,omron_monitor.pdf,Location/Definition,In which section of the manual can I find information on 'Troubleshooting and Maintenance'?,4. Troubleshooting and Maintenance.......12,"Time ........5 3. Using the Unit ...........................................6 3.1 Applying the Arm Cuff ............................6 3.2 How to Sit Correctly ...............................7 3.3 Taking a Reading...................................8 3.4 Using the Memory Function .................10 4. Troubleshooting and Maintenance.......12 4.1 The Icons and Error Messages ........... 12 4.2 Troubleshooting................................... 14 4.3 Maintenance........................................ 16 4.4 Storage................................................ 17 5. Optional Parts.........................................18 6. Technical Data ........................................19 7. Some Useful Information about Blood Pressure.... 22 Please read this instruction manual thoroughly before using the unit. Please keep for future reference. For specific information about your own blood pressure, CONSULT YOUR DOCTOR. Contents","2, 16, 18, 17, 14, 15",neutral,UNCERTAIN,0.1093,0.866,0.0248
omron_monitor_Q071,omron_monitor.pdf,Location/Definition,"Where is OMRON (DALIAN) CO., LTD. located?","Economic & Technical Development Zone Dalian 116600, CHINA","Check following components! Vériﬁer les composants suivants ! Prüfen Sie folgende Teile des Lieferumfangs! Controllare i componenti indicati di seguito! ¡Compruebe los siguientes componentes! Controleer de volgende onderdelen! Проверьте следующие компоненты! Digital Automatic Blood Pressure Monitor Model M3 Instruction Manual English Français Deutsch Italiano Español Nederlands IM-HEM-7200-E-05-11/2010 5329491-4C Manufacturer OMRON HEALTHCARE Co., Ltd. 24, Yamanouchi Yamanoshita-cho, Ukyo-ku, Kyoto 615-0084 JAPAN EU-representative OMRON HEALTHCARE EUROPE B.V. Kruisweg 577, 2132 NA Hoofddorp THE NETHERLANDS www.omron-healthcare.com Production facility Site de production Produktionsstätte Stabilimento di produzione Oﬁcina de producción Productiefaciliteit Производственное подразделение OMRON (DALIAN) CO., LTD. Economic & Technical Development Zone Dalian 116600, CHINA OMRON HEALTHCARE UK LIMITED Opal Drive Fox Milne Milton Keynes, MK15 0DG U.K.","1, 23, 22",entailment,GROUNDED,0.9873,0.0116,0.0011
omron_monitor_Q072,omron_monitor.pdf,Specification Lookup,What is the model number of this Digital Automatic Blood Pressure Monitor?,M3,"de producción Productiefaciliteit Производственное подразделение OMRON (DALIAN) CO., LTD. Economic & Technical Development Zone Dalian 116600, CHINA OMRON HEALTHCARE UK LIMITED Opal Drive Fox Milne Milton Keynes, MK15 0DG U.K. Subsidiary Succursale Niederlassung Consociata Empresa ﬁlial Dochteronderneming Дочерняя компания OMRON MEDIZINTECHNIK HANDELSGESELLSCHAFT mbH John-Deere-Str. 81a 68163 Mannheim GERMANY www.omron-medizintechnik.de OMRON Santé France SAS 14, rue de Lisbonne 93561 Rosny-sous-Bois Cedex, FRANCE Prodotto in Cina Сделано в Китае Hergestellt in China Geproduceerd in China Fabriqué en Chine Fabricado en China Made in China Русский","2, 1, 21, 11",entailment,GROUNDED,0.9827,0.0145,0.0028
omron_monitor_Q084,omron_monitor.pdf,Conditional Logic/Causal Reasoning,How can a measurement be cancelled if needed while it is in progress?,press the O/I START button to turn off the unit and to release the air in the arm cuff.,"3. Using the Unit 3.3 Taking a Reading Notes: • To cancel a measurement, press the O/I START button to turn off the unit and to release the air in the arm cuff. • Remain still while taking a measurement. 1. Press the O/I START button. The cuff will start to inflate automatically. The buzzer will sound when measurement is completed. Notes: • During measurement, the buzzer (if set to “on”) will beep in rhythm with your heartbeat. • Wait 2-3 minutes before taking another blood pressure measurement. Waiting between readings allows the arteries to return to the condition prior to taking the blood pressure measurement.","10, 8, 4, 15, 16, 14, 11, 3",entailment,GROUNDED,0.8204,0.1792,0.0005
omron_monitor_Q090,omron_monitor.pdf,Specification Lookup,What is the maximum number of measurement sets that the monitor can automatically store in its memory?,60 sets,"EN 6. Technical Data Note: Subject to technical modification without prior notice. Product Description Digital Automatic Blood Pressure Monitor Model OMRON M3 (HEM-7200-E/ HEM-7200-E8) Display LCD Digital Display Measurement Method Oscillometric method Measurement Range Pressure: 0 mmHg to 299 mmHg Pulse: 40 to 180/min. Accuracy Pressure: ±3 mmHg Pulse: ± 5% of display reading Inflation Fuzzy-logic controlled by electric pump Deflation Automatic pressure release valve Memory 60 Measurements with date and time Rating DC6V 4W Power Source 4 “AA” batteries 1.5V or AC/ DC adapter (Adapter S-9515336-9 (optional), INPUT AC100-240V 50/60Hz 0.12A) Battery Life Capacity of new alkaline batteries is approx.","12, 8, 7, 21, 11, 13",neutral,UNCERTAIN,0.0017,0.9951,0.0032
omron_monitor_Q100,omron_monitor.pdf,Location/Definition,What is the measurement method utilized by the OMRON M3 (HEM-7200-E/ HEM-7200-E8) blood pressure monitor?,Oscillometric method,"Check following components! Vériﬁer les composants suivants ! Prüfen Sie folgende Teile des Lieferumfangs! Controllare i componenti indicati di seguito! ¡Compruebe los siguientes componentes! Controleer de volgende onderdelen! Проверьте следующие компоненты! Digital Automatic Blood Pressure Monitor Model M3 Instruction Manual English Français Deutsch Italiano Español Nederlands IM-HEM-7200-E-05-11/2010 5329491-4C Manufacturer OMRON HEALTHCARE Co., Ltd. 24, Yamanouchi Yamanoshita-cho, Ukyo-ku, Kyoto 615-0084 JAPAN EU-representative OMRON HEALTHCARE EUROPE B.V. Kruisweg 577, 2132 NA Hoofddorp THE NETHERLANDS www.omron-healthcare.com Production facility Site de production Produktionsstätte Stabilimento di produzione Oﬁcina de producción Productiefaciliteit Производственное подразделение OMRON (DALIAN) CO., LTD. Economic & Technical Development Zone Dalian 116600, CHINA OMRON HEALTHCARE UK LIMITED Opal Drive Fox Milne Milton Keynes, MK15 0DG U.K.","21, 2, 14, 10, 8, 1, 22, 11",entailment,GROUNDED,0.9004,0.0819,0.0177
omron_monitor_Q107,omron_monitor.pdf,Specification Lookup,What is the pulse measurement range specified for this device?,Pulse: 40 to 180/min.,"3. Using the Unit 3.3 Taking a Reading Notes: • To cancel a measurement, press the O/I START button to turn off the unit and to release the air in the arm cuff. • Remain still while taking a measurement. 1. Press the O/I START button. The cuff will start to inflate automatically. The buzzer will sound when measurement is completed. Notes: • During measurement, the buzzer (if set to “on”) will beep in rhythm with your heartbeat. • Wait 2-3 minutes before taking another blood pressure measurement. Waiting between readings allows the arteries to return to the condition prior to taking the blood pressure measurement.","2, 24, 10, 21",neutral,UNCERTAIN,0.0045,0.9357,0.0598
omron_monitor_Q109,omron_monitor.pdf,Safety Information Lookup,"What is the primary intended use environment for this monitor, according to the manual?",general household use,"Use This product is designed to measure the blood pressure and pulse rate of people within the range of the designated arm cuff, following the instructions in this instruction manual. It is mainly designed for general household use. Please read the Important Safety Information in this instruction manual before using the unit. Important Safety Information........................1 1. Overview ...................................................3 2. Preparation ...............................................4 2.1 Installing/Replacing the Batteries...........4 2.2 Setting the Buzzer/ Date and Time ........5 3. Using the Unit ...........................................6 3.1 Applying the Arm Cuff ............................6 3.2 How to Sit Correctly ...............................7 3.3 Taking a Reading...................................8 3.4 Using the Memory Function .................10 4.","2, 23, 3, 11, 10, 21",neutral,UNCERTAIN,0.0142,0.9855,0.0003
omron_monitor_Q114,omron_monitor.pdf,Tool/Material Identification,"Other than batteries, what can be used to power this unit, as an optional extra?",AC adapter (optional),"5. Optional Parts Using the Optional AC Adapter 1. Insert the AC adapter plug into the AC adapter jack on the rear side of the main unit. 2. Plug the AC adapter into an electrical outlet. To disconnect the AC adapter, unplug the AC adapter from the electrical outlet first and then remove the AC adapter plug from the main unit. Medium Arm Cuff Arm circumference 22 - 32 cm Large Arm Cuff Arm circumference 32 - 42 cm AC Adapter S CM2-9513256-6 (Model: HEM-CR24) CM1-9997578-9 CL2-9513255-8 (Model: HEM-CL24) CL1-9996760-3 Adapter S-9515336-9","20, 4, 3, 21, 14",entailment,GROUNDED,0.9867,0.0066,0.0068
omron_monitor_Q115,omron_monitor.pdf,Tool/Material Identification,What part of the cuff assembly needs to be unplugged from the air connector before storage?,air tube,"months or more. • Do not use new and used batteries together. General Precautions • Do not apply strong shocks and vibrations to or drop the unit and arm cuff. • Do not take measurements after bathing, drinking alcohol, smoking, exercising or eating. • Do not forcibly bend the arm cuff or bend the air tube excessively. • When removing the air tube, pull on the air plug at the connection with the main unit not the tube itself. • Do not inflate the arm cuff when it is not wrapped around your arm. • Do not wash the arm cuff or immerse it in water.","16, 19, 3, 4, 20, 15",neutral,UNCERTAIN,0.4228,0.5764,0.0008
omron_monitor_Q120,omron_monitor.pdf,Procedural Step Inquiry,What is the first instruction provided for the task of installing or replacing batteries?,1 Removethebatterycover,"• If battery fluid should get on your skin or clothing, immediately rinse with plenty of clean water. • Use only four “AA” alkaline or manganese batteries with this unit. Do not use other types of batteries. • Do not insert the batteries with their polarities incorrectly aligned. • Replace old batteries with new ones immediately. Replace all four batteries at the same time. • Remove the batteries if the unit will not be used for three months or more. • Do not use new and used batteries together. General Precautions • Do not apply strong shocks and vibrations to or drop the unit and arm cuff.","4, 14, 6, 3, 17, 7",neutral,UNCERTAIN,0.009,0.9902,0.0008
omron_monitor_Q125,omron_monitor.pdf,Location/Definition,In which section of the manual can one find explanations for icons and error messages?,4.1 The Icons and Error Messages ........... 12,EN 1. Overview Main unit Display O/I START ( ) button Memory button Up/Down ( ) buttons Buzzer and Date/Time setting ( ) button Air Jack Battery compartment AC adapter jack (for optional AC adapter) Arm cuff Arm cuff (Medium cuff: arm circumference 22-32cm) Coloured Marker Air tube Air plug Display Systolic blood pressure Diastolic blood pressure Heartbeat symbol (Flashes during measurement) Memory symbol Deflation symbol Average value symbol Movement error symbol Date/Time display Blood pressure level indicator Pulse display Buzzer symbol Cuff wrapping guide Battery low symbol Irregular heartbeat symbol Open the rear cover page to read following: The alphabet in the rear cover page correspond to those in the body page.,"14, 2, 15, 5, 16",contradiction,HALLUCINATION,0.073,0.3862,0.5408
omron_monitor_Q129,omron_monitor.pdf,Conditional Logic/Causal Reasoning,Under what medical conditions is it advised to consult a doctor before using this monitor?,prior to using in pregnancy or if diagnosed with arrhythmia or arteriosclerosis.,"EN Important Safety Information Consult your doctor prior to using in pregnancy or if diagnosed with arrhythmia or arteriosclerosis. Please read this section carefully before using the unit. Warning: • Indicates a potentially hazardous situation which, if not avoided, could result in death or serious injury. (General Usage) • Always consult your doctor. Self-diagnosis of measurement results and self-treatment are dangerous. • People with severe blood flow problems, or blood disorders, should consult a doctor before using the unit, as cuff inflation can cause internal bleeding. (AC Adapter Usage) • Never plug in or unplug the power cord from the electric outlet with wet hands.","3, 10, 2, 24, 23",entailment,GROUNDED,0.8789,0.1211,0.0
omron_monitor_Q130,omron_monitor.pdf,Conditional Logic/Causal Reasoning,What does the monitor do with the measurement data automatically after a reading?,The monitor automatically stores the measurement in its memory.,"3. Using the Unit 3.4 Using the Memory Function The monitor automatically stores the result up to 60 sets. It can also calculate an average reading based on the measurements from the last three readings taken within 10 minutes. If there are only two readings in memory for that period, the average will be based on two readings. If there is one reading in memory for that period, the average will be based on one reading. Notes: • If the memory is full, the monitor will delete the oldest readings. • When viewing the reading taken without setting the date and time, “-:--” is displayed instead of the date and time.","12, 11, 21, 2, 10",entailment,GROUNDED,0.9941,0.0055,0.0004
prusa_3d-printer_Q002,prusa_3d-printer.pdf,Procedural Step Inquiry,"As a new user, what are the initial steps I should take to get my first print going?","1. Read the Safety Instructions carefully (page 8).\n\n2. Place the printer on a flat and stable surface and plug it in. (page 15)\n\n3. If you bought the assembled printer, remove the test print from the print sheet (remove the\n\nsheet, bend it, remove the print), then place the print sheet back. (page 17)\n\n4. Calibrate the printer using the Selftest Wizard. (page 18)\n\n5. Insert the USB drive that came with your printer and print your first object. (page 23)","along with other useful information, can be found at prusa.io/mk4s. The handbook primarily references the Original Prusa MK4S, as it is virtually identical to the MK3.9S from the user's perspective. Therefore, the instructions provided are equally applicable to the MK3.9S. Quick Guide to the First Print Read the Safety Instructions carefully (page 8). 1. Place the printer on a flat and stable surface and plug it in. (page 15) 2. If you bought the assembled printer, remove the test print from the print sheet (remove the 3. sheet, bend it, remove the print), then place the print sheet back. (page 17) Calibrate the printer using the Selftest Wizard.","2, 17, 23, 16, 29",neutral,UNCERTAIN,0.3233,0.6729,0.0038
prusa_3d-printer_Q005,prusa_3d-printer.pdf,Specification Lookup,What is the specified build volume for the Original Prusa MK4S?,250×210×220 mm,the Adhesion ............................................................................................................ 8.2. Keeping the Printer Clean .................................................................................................................... 8.3. Bearings ....................................................................................................................................................... 8.4. Fans ................................................................................................................................................................. 8.5. Extruder Feeding Gear ........................................................................................................................... 8.6. Electronics .................................................................................................................................................... 8.7. Extruder is Clogged or Jammed ......................................................................................................... 8.8. Cleaning the Nozzle ................................................................................................................................ 8.8.1. The filament does not come out of the nozzle. ............................................................... 8.8.2. The filament does not come out of the nozzle or only a small amount comes out .......................................................................................................................................................... 8.9. Troubleshooting Faulty Sensor Readings and Removing Errors ....................................... 8.10. Filament Sensor ...................................................................................................................................... 9. FAQ - Frequently Asked Questions and Basic Troubleshooting .............................................. 9.1. Mesh Bed Leveling Fails ........................................................................................................................ 9.2. Printer Does Not Recognize the Inserted USB Drive ..............................................................,"43, 5, 45, 4, 1, 6, 2",neutral,UNCERTAIN,0.3703,0.3769,0.2528
prusa_3d-printer_Q007,prusa_3d-printer.pdf,Specification Lookup,What are the WLAN frequency bands supported by the printer?,"WLAN: 2400,0-2483,5 MHz",.................................................................................................................... 5.9. Original Prusa Enclosure ...................................................................................................................... 5.10. Flashing an Unofficial (Unsigned) Firmware: ............................................................................ 6. Printing Your Own Models ............................................................................................................................. 6.1. Obtaining Printable Models ................................................................................................................. 6.2. Create Your Own Model ....................................................................................................................... 6.3. What is a G-code File? .......................................................................................................................... 6.4. PrusaSlicer ................................................................................................................................................... 6.5. PrusaSlicer Interface Explained ........................................................................................................ 6.5.1. Initial Setup and General Workflow .................................................................................... 6.5.2. Using Supports ............................................................................................................................. 6.5.3. Speed vs Print Quality ............................................................................................................... 6.5.4. Infill .................................................................................................................................................... 6.5.5. Brim ................................................................................................................................................... 6.5.6. Printing Objects Larger than the Print Volume .............................................................,"6, 4, 32, 18, 33",neutral,UNCERTAIN,0.1273,0.7161,0.1566
